{
  "task_id": "sm_gba1_ambroxol_analog",
  "category": "small_molecule",
  "is_negative_control": false,
  "rubric_id": "pdtx_sm_candidate_eval_v1",
  "gold_label": "Conditional Go",
  "preferred_decision": "Conditional Go",
  "acceptable_decisions": ["Go"],
  "gold_rationale": "A GCase pharmacological chaperone is mechanistically well-aligned with GBA1-associated PD (GCase deficiency -> lysosomal dysfunction -> alpha-synuclein). The candidate is a plausible chaperone, but progression should be conditional on confirming CNS exposure (BBB) and clearing standard ADMET/safety liabilities. Mechanistic plausibility must not be presented as proven disease modification.",
  "required_concepts": [
    "GCase",
    "GBA1",
    "lysosomal",
    "alpha-synuclein",
    "pharmacological chaperone",
    "blood-brain barrier",
    "ADMET",
    "safety liability",
    "next experiment"
  ],
  "acceptable_variants": [
    "glucocerebrosidase", "BBB", "blood brain barrier", "a-synuclein", "α-synuclein",
    "synuclein", "chaperone", "lysosome", "CNS penetration", "GCase activity assay"
  ],
  "red_flags": [
    "claims proven disease modification without sufficient clinical evidence",
    "ignores blood-brain barrier / CNS penetration",
    "ignores ADMET or safety liabilities",
    "treats docking/binding as proof of efficacy"
  ],
  "rubric": {
    "criteria": [
      {"name": "pd_mechanism_relevance", "weight": 0.20, "scale": "0-5", "description": "Correctly connects GBA1/GCase/lysosome/alpha-synuclein to the candidate."},
      {"name": "target_moa_reasoning", "weight": 0.15, "scale": "0-5", "description": "Plausible chaperone mechanism-of-action reasoning."},
      {"name": "admet_interpretation", "weight": 0.20, "scale": "0-5", "description": "Sound ADMET interpretation incl. BBB, solubility, clearance, CYP."},
      {"name": "safety_risk_identification", "weight": 0.15, "scale": "0-5", "description": "Identifies hERG/AMES/DILI and other safety liabilities."},
      {"name": "go_no_go_quality", "weight": 0.15, "scale": "0-5", "description": "Decision is justified and calibrated to the evidence."},
      {"name": "next_experiment_quality", "weight": 0.10, "scale": "0-5", "description": "Proposes an informative, decision-relevant next experiment."},
      {"name": "uncertainty_handling", "weight": 0.05, "scale": "0-5", "description": "Honest about limits; no overclaiming."}
    ]
  }
}
